{
  "$schema": "../schemas/delivery-v2-requirements.schema.json",
  "schemaVersion": 1,
  "contract": "delivery-v2",
  "canonicalSpec": "docs/delivery-v2/MASTER_SPEC.md",
  "roadmap": "docs/delivery-v2/ROADMAP.md",
  "umbrellaIssue": 27,
  "statusModel": [
    "planned",
    "implemented",
    "validated",
    "rolled-out"
  ],
  "completionPolicy": {
    "terminalStatuses": [
      "validated",
      "rolled-out"
    ],
    "allRequiredRequirementsMustBeTerminal": true,
    "v1RetirementRequirement": "DV2-014"
  },
  "requirements": [
    {
      "id": "DV2-001",
      "title": "Deterministic GitHub-native control plane",
      "status": "validated",
      "requiredForV2Default": true,
      "summary": "GitHub owns delivery identity, deterministic planning, risk and execution policy; AI is a bounded worker, not the orchestrator.",
      "implementationRefs": [
        "file:src/v2/delivery-plan.mjs",
        "file:src/v2/execution-policy.mjs",
        "file:src/v2/risk-profile.mjs"
      ],
      "validationRefs": [
        "file:test/v2-delivery-plan.test.mjs",
        "file:test/v2-risk-profile.test.mjs",
        "github:delivery-orchestrator#21"
      ],
      "rolloutRefs": [],
      "trackingIssue": 27
    },
    {
      "id": "DV2-002",
      "title": "Deterministic provider dispatch with no silent fallback",
      "status": "validated",
      "requiredForV2Default": true,
      "summary": "Provider+risk resolves to one pinned worker; missing auth or dispatch failure fails closed and never substitutes another provider.",
      "implementationRefs": [
        "file:src/v2/provider-dispatch.mjs",
        "file:src/v2/provider-policy.mjs"
      ],
      "validationRefs": [
        "file:test/v2-provider-dispatch.test.mjs",
        "file:test/v2-provider-policy.test.mjs",
        "github:delivery-orchestrator#23"
      ],
      "rolloutRefs": [],
      "trackingIssue": 27
    },
    {
      "id": "DV2-003",
      "title": "Safe-output AI workers and credential isolation",
      "status": "validated",
      "requiredForV2Default": true,
      "summary": "AI workers receive read capability and bounded safe outputs; write credentials are not exposed to agent shell execution.",
      "implementationRefs": [
        "file:.github/workflows/delivery-v2-worker-codex-fast.md",
        "file:.github/workflows/delivery-v2-worker-claude-fast.md",
        "file:.github/workflows/delivery-v2-worker-copilot-fast.md"
      ],
      "validationRefs": [
        "file:test/v2-worker-contract.test.mjs",
        "github:delivery-orchestrator#23"
      ],
      "rolloutRefs": [],
      "trackingIssue": 27
    },
    {
      "id": "DV2-004",
      "title": "Risk profiles, hard budgets and bounded provider work",
      "status": "validated",
      "requiredForV2Default": true,
      "summary": "FAST/STANDARD/CRITICAL define CI depth, audit policy, implementation attempts, turns and AI-credit ceilings; an exact pre-material context-rebuild breaker may consume the next ordinary slot in the same controller cycle, while changed-SHA recovery remains a separate bounded exception and neither path increases the ceiling.",
      "implementationRefs": [
        "file:src/v2/execution-policy.mjs",
        "file:src/v2/provider-policy.mjs",
        "file:scripts/guard-delivery-v2-reentry.mjs",
        "file:scripts/reserve-delivery-v2-initial-attempt.mjs",
        "file:src/v2/pre-material-recovery.mjs",
        "file:scripts/run-delivery-v2-controller.mjs",
        "file:.github/workflows/delivery-v2-worker-codex-critical.md"
      ],
      "validationRefs": [
        "file:test/v2-delivery-plan.test.mjs",
        "file:test/v2-provider-policy.test.mjs",
        "file:test/v2-reentry-bootstrap-recovery.test.mjs",
        "github:delivery-orchestrator#21",
        "file:test/v2-pre-material-retry.test.mjs"
      ],
      "rolloutRefs": [],
      "trackingIssue": 27
    },
    {
      "id": "DV2-005",
      "title": "Adaptive CI core and reusable risk output contract",
      "status": "validated",
      "requiredForV2Default": true,
      "summary": "A deterministic classifier selects focused, affected or full CI while caller repositories retain their concrete build/test commands.",
      "implementationRefs": [
        "file:src/v2/ci-plan.mjs",
        "file:actions/delivery-v2-risk/action.yml",
        "file:.github/workflows/delivery-v2-classify-ci.yml"
      ],
      "validationRefs": [
        "file:test/v2-adaptive-ci.test.mjs",
        "github:delivery-orchestrator#26"
      ],
      "rolloutRefs": [],
      "trackingIssue": 27
    },
    {
      "id": "DV2-006",
      "title": "Fail-closed classifier hardening for sensitive boundaries",
      "status": "validated",
      "requiredForV2Default": true,
      "summary": "FAST is a strict safe allowlist; authentication, authorization, session, identity, permissions, sensitive boundaries and unknown paths cannot be downgraded by convenient filenames or extensions.",
      "implementationRefs": [
        "file:src/v2/risk-profile.mjs",
        "file:src/v2/repository-risk-policy.mjs",
        "file:src/v2/ci-plan.mjs",
        "file:actions/delivery-v2-risk/index.cjs",
        "file:.github/workflows/delivery-v2-classify-ci.yml"
      ],
      "validationRefs": [
        "file:test/v2-risk-profile.test.mjs",
        "file:test/v2-adaptive-ci.test.mjs",
        "file:test/v2-delivery-plan.test.mjs"
      ],
      "rolloutRefs": [],
      "trackingIssue": 27
    },
    {
      "id": "DV2-007",
      "title": "Versioned classifier distribution and repository-specific promotion policy",
      "status": "validated",
      "requiredForV2Default": true,
      "summary": "Public/private target repositories consume a generated, fingerprinted policy snapshot from the private orchestrator; overrides may promote risk or add reviewed safe roots but cannot weaken core invariants.",
      "implementationRefs": [
        "file:src/v2/classifier-distribution.mjs",
        "file:scripts/export-delivery-v2-classifier.mjs",
        "file:scripts/verify-delivery-v2-targets.mjs",
        "file:.github/workflows/delivery-v2-sync-classifier.yml",
        "file:config/delivery-v2-targets/controle_calorias.json",
        "file:config/delivery-v2-targets/training-system.json",
        "github:delivery-orchestrator#31",
        "github:delivery-orchestrator#32",
        "github:controle_calorias#1069",
        "github:training-system#435"
      ],
      "validationRefs": [
        "github:controle_calorias#1069",
        "commit:controle_calorias@6507bdc0dc14ebc744de75393e5dc0c6bda8b112",
        "github:training-system#435",
        "commit:training-system@0fba4d2870e087775433b844e22f04c0daa84bcf",
        "classifier-fingerprint:35914f89844e0a6c35a436af1a1856e6a2b37ab7f5e0f3d3c1749e7a89d3ad24"
      ],
      "rolloutRefs": [
        "github:controle_calorias@develop",
        "github:training-system@develop"
      ],
      "trackingIssue": 27
    },
    {
      "id": "DV2-008",
      "title": "GitHub-native independent audit contract",
      "status": "validated",
      "requiredForV2Default": true,
      "summary": "Independent audit consumes exact GitHub candidate identity and CI evidence directly; a legacy .audit handoff is not mandatory for normal V2 deliveries.",
      "implementationRefs": [
        "file:src/v2/audit-contract.mjs",
        "file:schemas/delivery-v2-audit-input.schema.json",
        "file:schemas/delivery-v2-audit-result.schema.json",
        "file:src/v2/github-native-audit-runtime.mjs",
        "file:src/v2/github-audit-evidence.mjs",
        "file:scripts/run-delivery-v2-github-audit.mjs",
        "file:.github/workflows/delivery-v2-audit.yml",
        "file:src/v2/delivery-plan.mjs",
        "github:delivery-orchestrator#34",
        "github:delivery-orchestrator#50"
      ],
      "validationRefs": [
        "file:test/v2-audit-contract.test.mjs",
        "file:test/v2-github-native-audit-runtime.test.mjs",
        "file:test/v2-github-audit-evidence.test.mjs",
        "file:test/v2-independent-audit-isolation.test.mjs",
        "file:test/v2-audit-pilot-retirement.test.mjs",
        "file:docs/delivery-v2/evidence/dv2-008-critical-independent-audit.json",
        "github:delivery-orchestrator#48",
        "commit:c403eaf94fcd10b9fae6da3b781be3a3955e273c",
        "github-actions:34690592843",
        "github-actions:34690625580",
        "audit-request-fingerprint:363824d1c8391469fb0003351b58da757907d298bb6b2f2617e83cd51e8ac6a8"
      ],
      "rolloutRefs": [],
      "trackingIssue": 27
    },
    {
      "id": "DV2-009",
      "title": "Bounded remediation state machine",
      "status": "validated",
      "requiredForV2Default": true,
      "summary": "Actionable CI/audit findings re-enter a deterministic, attempt-bounded remediation loop; exhausted budgets escalate to humans. Persistent material hygiene UNKNOWN escalates without authorizing candidate mutation or consuming CI/audit remediation budgets.",
      "implementationRefs": [
        "file:src/v2/remediation-state-machine.mjs",
        "github:delivery-orchestrator#35"
      ],
      "validationRefs": [
        "file:test/v2-remediation-state-machine.test.mjs",
        "file:test/v2-remediation-live-evidence.test.mjs",
        "file:docs/delivery-v2/evidence/dv2-009-bounded-remediation.json",
        "github:delivery-orchestrator#52",
        "commit:c104998bcd71d68a2ae90907ff5e522e34c318d3",
        "commit:fecea01e365de2ed31854db5a4f22f51fc660ee7",
        "github-actions:34692649283"
      ],
      "rolloutRefs": [],
      "trackingIssue": 27
    },
    {
      "id": "DV2-010",
      "title": "Exact-head release gate",
      "status": "validated",
      "requiredForV2Default": true,